<?xml version="1.0" encoding="UTF-8"?>

<!--L
   Copyright Washington University in St. Louis
   Copyright SemanticBits
   Copyright Persistent Systems
   Copyright Krishagni

   Distributed under the OSI-approved BSD 3-Clause License.
   See http://ncip.github.com/catissue-utilities/LICENSE.txt for details.
L-->

<columnMap xmlns:xsi="http://www.w3.org/2001/XMLSchema-instance"
    xsi:noNamespaceSchemaLocation="../xml/caTissueTextMap.xsd" 
    headerRow="true"
    fileType="xlText">

    <dateFormat>MM/dd/yyyy</dateFormat>
    <rowClass>Participant</rowClass>
    <column attributeName="protocolTitle" fixedValue="Demo of collection protocol"/>
    <column attributeName="PPI" columnNo="2"/>
    <column attributeName="gender" columnNo="1">  
        <valueMapping>
            <valueMap fromValue="F" ignoreCase="true" toValue="Female Gender"/>
            <valueMap fromValue="M" ignoreCase="true" toValue="Male Gender"/>
        </valueMapping>
    </column>
    <column attributeName="medicalRecordNumber" columnNo="2"/>
    <column attributeName="participantActivityStatus" fixedValue="Active"/>
    <column attributeName="regActivityStatus" fixedValue="Active"/>
    <column attributeName="siteName" fixedValue="Haven outpatients clinic"/>

</columnMap>
